{
  "airep_version": "0.1",
  "subject": {
    "runtime": "phionyx-core",
    "producer": "phionyx/0.7.1",
    "decision_index": 2,
    "trace_id": "trace-trusted-gate-test",
    "timestamp_utc": "2026-05-30T00:00:02Z"
  },
  "input": {
    "input_ref": "sha256:4baa7795f4485e2fa7f22b39816a556660007a4471c306941a7c5bf73bec5ec7",
    "governance_state": {
      "policy_version": "p1",
      "prior_context_bound": true
    }
  },
  "claim": {
    "assertion": "checkpoint: witnesses a committed chain head",
    "basis": [
      "safety_gate"
    ]
  },
  "output": {
    "result_ref": "sha256:beffb2d13cc29a7af4a5e356921be9a678566612ce51c12d635eddf60451f582",
    "redacted": false
  },
  "evidence": [
    {
      "type": "policy",
      "ref": "policy://safety/v1",
      "resolvable": true
    }
  ],
  "directive": {
    "verb": "release",
    "policy_basis": [
      "safety_gate"
    ]
  },
  "scope": {
    "covers": [
      "chain head pinned by a witness"
    ],
    "does_not_cover": [
      "witness key trust is asserted, not corroborated here"
    ]
  },
  "integrity": {
    "previous": "sha256:89c7b5654ddc32e931b544f45a442d54802b19598dcc9509d6c7afe4a719d704",
    "canonical_json": true,
    "current": "sha256:e151acd547b37c8a84ec23be56373542fe9e07ca79da2ae737777a984a56af98",
    "signature": {
      "alg": "Ed25519",
      "value": "819176857e17a1ae9cbfbb1e991eb2713276285ef07acd8f17ac526b6266c18ddfd86e5ed785e2b42e1c2e86bf3bb1f44b16bf05677d1fd210e3882d8c69940c"
    }
  },
  "profiles": {
    "key_trust": {
      "key_id": "airep-test-key-1",
      "issuer": "self",
      "algorithm": "Ed25519",
      "public_key": {
        "format": "raw_hex",
        "value": "3ccd241cffc9b3618044b97d036d8614593d8b017c340f1dee8773385517654b"
      },
      "validity": {
        "not_before": "2026-05-30T00:00:00Z"
      },
      "revocation": {
        "revoked": false
      }
    },
    "freshness_witness": {
      "chain_id": "airep:chain:trusted-gate-test",
      "head": {
        "decision_index": 1,
        "current": "sha256:89c7b5654ddc32e931b544f45a442d54802b19598dcc9509d6c7afe4a719d704",
        "length": 2
      },
      "witness": {},
      "freshness": {
        "witness_timestamp_utc": "2026-05-30T00:00:05Z"
      }
    }
  }
}
